"","id","structure","post_date","comm_date","num_comments","subreddit","upvote_prop","post_score","author","user","comment_score","controversiality","comment","title","post_text","link","domain","URL"
"151",7,"4","09-12-19","09-12-19",12,"Art",0.98,342,"i-am-pan-pan","AutumnLeaves1939",1,0,"looks beautiful type watercolors use","Harvest Moon, Me, Watercolors, 2019.","","https://i.redd.it/7zghwov5ii341.jpg","i.redd.it","http://www.reddit.com/r/Art/comments/e82ytn/harvest_moon_me_watercolors_2019/?ref=search_posts"
"152",8,"4_1","09-12-19","09-12-19",12,"Art",0.98,342,"i-am-pan-pan","i-am-pan-pan",1,0,"thanks  used winston newton watercolors","Harvest Moon, Me, Watercolors, 2019.","","https://i.redd.it/7zghwov5ii341.jpg","i.redd.it","http://www.reddit.com/r/Art/comments/e82ytn/harvest_moon_me_watercolors_2019/?ref=search_posts"
"153",1,"1","03-12-19","03-12-19",11,"Art",0.97,341,"natapio","tholzel",2,0,"check polish painter stanisbaw wyspiadski can perfect inspiration","No Tittle, me, watercolor, 2019","","https://i.redd.it/m414udmzif241.jpg","i.redd.it","http://www.reddit.com/r/Art/comments/e5hy2b/no_tittle_me_watercolor_2019/?ref=search_posts"
"154",2,"1_1","03-12-19","03-12-19",11,"Art",0.97,341,"natapio","natapio",1,0,"thank advice ","No Tittle, me, watercolor, 2019","","https://i.redd.it/m414udmzif241.jpg","i.redd.it","http://www.reddit.com/r/Art/comments/e5hy2b/no_tittle_me_watercolor_2019/?ref=search_posts"
"155",3,"2","03-12-19","03-12-19",11,"Art",0.97,341,"natapio","elzorrodorito",2,0," really like style thanks sharing","No Tittle, me, watercolor, 2019","","https://i.redd.it/m414udmzif241.jpg","i.redd.it","http://www.reddit.com/r/Art/comments/e5hy2b/no_tittle_me_watercolor_2019/?ref=search_posts"
"156",4,"3","03-12-19","03-12-19",11,"Art",0.97,341,"natapio","Nunya_Bsnss",2,0,"oh gosh  love  precious lighthearted quality","No Tittle, me, watercolor, 2019","","https://i.redd.it/m414udmzif241.jpg","i.redd.it","http://www.reddit.com/r/Art/comments/e5hy2b/no_tittle_me_watercolor_2019/?ref=search_posts"
"157",5,"4","03-12-19","03-12-19",11,"Art",0.97,341,"natapio","boof_boof_0",2,0," love style keep  love see","No Tittle, me, watercolor, 2019","","https://i.redd.it/m414udmzif241.jpg","i.redd.it","http://www.reddit.com/r/Art/comments/e5hy2b/no_tittle_me_watercolor_2019/?ref=search_posts"
"158",6,"4_1","03-12-19","03-12-19",11,"Art",0.97,341,"natapio","natapio",1,0,"thank lovlely comment ll try best","No Tittle, me, watercolor, 2019","","https://i.redd.it/m414udmzif241.jpg","i.redd.it","http://www.reddit.com/r/Art/comments/e5hy2b/no_tittle_me_watercolor_2019/?ref=search_posts"
"159",7,"5","03-12-19","04-12-19",11,"Art",0.97,341,"natapio","dasher11",2,0," love  ever commissions","No Tittle, me, watercolor, 2019","","https://i.redd.it/m414udmzif241.jpg","i.redd.it","http://www.reddit.com/r/Art/comments/e5hy2b/no_tittle_me_watercolor_2019/?ref=search_posts"
"160",8,"5_1","03-12-19","04-12-19",11,"Art",0.97,341,"natapio","natapio",1,0,"actually  ","No Tittle, me, watercolor, 2019","","https://i.redd.it/m414udmzif241.jpg","i.redd.it","http://www.reddit.com/r/Art/comments/e5hy2b/no_tittle_me_watercolor_2019/?ref=search_posts"
"161",9,"6","03-12-19","04-12-19",11,"Art",0.97,341,"natapio","collapsingwaves",2,0,"really lovely   my daughter kind happy contentment around animals","No Tittle, me, watercolor, 2019","","https://i.redd.it/m414udmzif241.jpg","i.redd.it","http://www.reddit.com/r/Art/comments/e5hy2b/no_tittle_me_watercolor_2019/?ref=search_posts"
"162",10,"6_1","03-12-19","04-12-19",11,"Art",0.97,341,"natapio","natapio",1,0,"aww must adorable  daughter remind cousin  loves animals around cat happy child world","No Tittle, me, watercolor, 2019","","https://i.redd.it/m414udmzif241.jpg","i.redd.it","http://www.reddit.com/r/Art/comments/e5hy2b/no_tittle_me_watercolor_2019/?ref=search_posts"
"163",1,"1","09-12-19","09-12-19",5,"Art",0.97,416,"artsychimichanga","Rebelsoul3480",3,0,"great  really like blending choice colors","The Beauty of Death, Evan Olinger, watercolor, 2019","","https://i.redd.it/ubvay1jf2p341.jpg","i.redd.it","http://www.reddit.com/r/Art/comments/e8i6d6/the_beauty_of_death_evan_olinger_watercolor_2019/?ref=search_posts"
"164",2,"2","09-12-19","10-12-19",5,"Art",0.97,416,"artsychimichanga","Brapika",2,0,"oh look new phone background","The Beauty of Death, Evan Olinger, watercolor, 2019","","https://i.redd.it/ubvay1jf2p341.jpg","i.redd.it","http://www.reddit.com/r/Art/comments/e8i6d6/the_beauty_of_death_evan_olinger_watercolor_2019/?ref=search_posts"
"165",3,"3","09-12-19","10-12-19",5,"Art",0.97,416,"artsychimichanga","nrm64",1,0,"big dia de los muertos vibe","The Beauty of Death, Evan Olinger, watercolor, 2019","","https://i.redd.it/ubvay1jf2p341.jpg","i.redd.it","http://www.reddit.com/r/Art/comments/e8i6d6/the_beauty_of_death_evan_olinger_watercolor_2019/?ref=search_posts"
"166",4,"4","09-12-19","10-12-19",5,"Art",0.97,416,"artsychimichanga","TacosAnonymous",1,0,"10 10 display house","The Beauty of Death, Evan Olinger, watercolor, 2019","","https://i.redd.it/ubvay1jf2p341.jpg","i.redd.it","http://www.reddit.com/r/Art/comments/e8i6d6/the_beauty_of_death_evan_olinger_watercolor_2019/?ref=search_posts"
"167",5,"5","09-12-19","10-12-19",5,"Art",0.97,416,"artsychimichanga","ozymandias-js",1,0,"really good detail wish  watercolor  skull well","The Beauty of Death, Evan Olinger, watercolor, 2019","","https://i.redd.it/ubvay1jf2p341.jpg","i.redd.it","http://www.reddit.com/r/Art/comments/e8i6d6/the_beauty_of_death_evan_olinger_watercolor_2019/?ref=search_posts"
"168",1,"1","06-12-19","06-12-19",7,"Art",0.98,439,"marciocbarra","Hazy_Lights",2,0,"wonderful love style","Warm glow, me, watercolor and ink, 2019","","https://i.redd.it/yfwwbybxaz241.jpg","i.redd.it","http://www.reddit.com/r/Art/comments/e6wcd5/warm_glow_me_watercolor_and_ink_2019/?ref=search_posts"
"169",2,"1_1","06-12-19","06-12-19",7,"Art",0.98,439,"marciocbarra","marciocbarra",2,0,"thanks  lot","Warm glow, me, watercolor and ink, 2019","","https://i.redd.it/yfwwbybxaz241.jpg","i.redd.it","http://www.reddit.com/r/Art/comments/e6wcd5/warm_glow_me_watercolor_and_ink_2019/?ref=search_posts"
"170",3,"2","06-12-19","06-12-19",7,"Art",0.98,439,"marciocbarra","Alice8Ft",2,0,"awesome think make sense title background dark simply white  think contrast look stupendous well try ","Warm glow, me, watercolor and ink, 2019","","https://i.redd.it/yfwwbybxaz241.jpg","i.redd.it","http://www.reddit.com/r/Art/comments/e6wcd5/warm_glow_me_watercolor_and_ink_2019/?ref=search_posts"
"171",4,"2_1","06-12-19","06-12-19",7,"Art",0.98,439,"marciocbarra","marciocbarra",3,0," one  similar style sky darkened  take  look","Warm glow, me, watercolor and ink, 2019","","https://i.redd.it/yfwwbybxaz241.jpg","i.redd.it","http://www.reddit.com/r/Art/comments/e6wcd5/warm_glow_me_watercolor_and_ink_2019/?ref=search_posts"
"172",5,"3","06-12-19","06-12-19",7,"Art",0.98,439,"marciocbarra","Caracasy",1,0,"brave try considering less familiar writing language","Warm glow, me, watercolor and ink, 2019","","https://i.redd.it/yfwwbybxaz241.jpg","i.redd.it","http://www.reddit.com/r/Art/comments/e6wcd5/warm_glow_me_watercolor_and_ink_2019/?ref=search_posts"
"173",6,"3_1","06-12-19","06-12-19",7,"Art",0.98,439,"marciocbarra","marciocbarra",2,0,"ahah thanks  tried mimic writing best ","Warm glow, me, watercolor and ink, 2019","","https://i.redd.it/yfwwbybxaz241.jpg","i.redd.it","http://www.reddit.com/r/Art/comments/e6wcd5/warm_glow_me_watercolor_and_ink_2019/?ref=search_posts"
"174",1,"1","08-12-19","08-12-19",8,"Art",0.99,439,"juliamailinnea","damniloveraisins",5,0,"really sick man nice job","untitled, me, ink/watercolor/pencil, 2019","","https://i.redd.it/8bvou1s0vg341.jpg","i.redd.it","http://www.reddit.com/r/Art/comments/e7yoav/untitled_me_inkwatercolorpencil_2019/?ref=search_posts"
"175",2,"1_1","08-12-19","09-12-19",8,"Art",0.99,439,"juliamailinnea","juliamailinnea",2,0,"thank","untitled, me, ink/watercolor/pencil, 2019","","https://i.redd.it/8bvou1s0vg341.jpg","i.redd.it","http://www.reddit.com/r/Art/comments/e7yoav/untitled_me_inkwatercolorpencil_2019/?ref=search_posts"
"176",3,"2","08-12-19","09-12-19",8,"Art",0.99,439,"juliamailinnea","SergeantofMargaritas",2,0,"amazing  d totally hang wall","untitled, me, ink/watercolor/pencil, 2019","","https://i.redd.it/8bvou1s0vg341.jpg","i.redd.it","http://www.reddit.com/r/Art/comments/e7yoav/untitled_me_inkwatercolorpencil_2019/?ref=search_posts"
"177",4,"2_1","08-12-19","09-12-19",8,"Art",0.99,439,"juliamailinnea","juliamailinnea",1,0," compliment thank","untitled, me, ink/watercolor/pencil, 2019","","https://i.redd.it/8bvou1s0vg341.jpg","i.redd.it","http://www.reddit.com/r/Art/comments/e7yoav/untitled_me_inkwatercolorpencil_2019/?ref=search_posts"
"178",1,"1","04-12-19","04-12-19",14,"Art",0.99,786,"salt_watercolors","IAmNotAWoodenDuck",5,0,"really gorgeous  love colours ve trying teach paint watercolour definitely  level  aspire","Coyote, Me, Watercolor, 2018","","https://i.redd.it/erwzai5ryl241.jpg","i.redd.it","http://www.reddit.com/r/Art/comments/e5ycvn/coyote_me_watercolor_2018/?ref=search_posts"
"179",2,"2","04-12-19","04-12-19",14,"Art",0.99,786,"salt_watercolors","ironicplatypus84",3,0," admire ability texturize watercolor fur gives  fur feeling awesome job","Coyote, Me, Watercolor, 2018","","https://i.redd.it/erwzai5ryl241.jpg","i.redd.it","http://www.reddit.com/r/Art/comments/e5ycvn/coyote_me_watercolor_2018/?ref=search_posts"
"180",3,"3","04-12-19","04-12-19",14,"Art",0.99,786,"salt_watercolors","eclecticlove1",2,0,"nice work wild face can hardest part nailed better anything","Coyote, Me, Watercolor, 2018","","https://i.redd.it/erwzai5ryl241.jpg","i.redd.it","http://www.reddit.com/r/Art/comments/e5ycvn/coyote_me_watercolor_2018/?ref=search_posts"
"181",4,"4","04-12-19","04-12-19",14,"Art",0.99,786,"salt_watercolors","Ziribbit",2,0,"nice really captures funky physics animals bodies  saw one walking dog  month ago chasing injured deer","Coyote, Me, Watercolor, 2018","","https://i.redd.it/erwzai5ryl241.jpg","i.redd.it","http://www.reddit.com/r/Art/comments/e5ycvn/coyote_me_watercolor_2018/?ref=search_posts"
"182",5,"5","04-12-19","04-12-19",14,"Art",0.99,786,"salt_watercolors","cnnctd_tsimon",2,0," nice job  like style simple elegant keep good work ","Coyote, Me, Watercolor, 2018","","https://i.redd.it/erwzai5ryl241.jpg","i.redd.it","http://www.reddit.com/r/Art/comments/e5ycvn/coyote_me_watercolor_2018/?ref=search_posts"
"183",6,"6","04-12-19","04-12-19",14,"Art",0.99,786,"salt_watercolors","IHave13Personalitys",2,0,"omg drop dead gorgeous might favourite day d","Coyote, Me, Watercolor, 2018","","https://i.redd.it/erwzai5ryl241.jpg","i.redd.it","http://www.reddit.com/r/Art/comments/e5ycvn/coyote_me_watercolor_2018/?ref=search_posts"
"184",7,"7","04-12-19","04-12-19",14,"Art",0.99,786,"salt_watercolors","Iantlopp",1,0," think m love picture signature shat","Coyote, Me, Watercolor, 2018","","https://i.redd.it/erwzai5ryl241.jpg","i.redd.it","http://www.reddit.com/r/Art/comments/e5ycvn/coyote_me_watercolor_2018/?ref=search_posts"
"185",8,"7_1","04-12-19","04-12-19",14,"Art",0.99,786,"salt_watercolors","aasparaguus",1,0,"looks like salt","Coyote, Me, Watercolor, 2018","","https://i.redd.it/erwzai5ryl241.jpg","i.redd.it","http://www.reddit.com/r/Art/comments/e5ycvn/coyote_me_watercolor_2018/?ref=search_posts"
"186",9,"7_1_1","04-12-19","04-12-19",14,"Art",0.99,786,"salt_watercolors","Iantlopp",1,0,"ohhh  didn see ops name first hah","Coyote, Me, Watercolor, 2018","","https://i.redd.it/erwzai5ryl241.jpg","i.redd.it","http://www.reddit.com/r/Art/comments/e5ycvn/coyote_me_watercolor_2018/?ref=search_posts"
"187",10,"8","04-12-19","04-12-19",14,"Art",0.99,786,"salt_watercolors","TheGreenTrout",1,0,"beautiful  love something like study","Coyote, Me, Watercolor, 2018","","https://i.redd.it/erwzai5ryl241.jpg","i.redd.it","http://www.reddit.com/r/Art/comments/e5ycvn/coyote_me_watercolor_2018/?ref=search_posts"
"188",1,"1","03-12-19","03-12-19",17,"Art",0.94,843,"Tuhndraa","suricataholografica",33,0," hope used kind laquer set watercolors place  really hate see shoes getting wet painting ruined","Cat screaming meme, My friend Lea, Watercolors on shoes, 2019","","https://i.redd.it/umoh5u7z7c241.jpg","i.redd.it","http://www.reddit.com/r/Art/comments/e5au1w/cat_screaming_meme_my_friend_lea_watercolors_on/?ref=search_posts"
"189",2,"2","03-12-19","03-12-19",17,"Art",0.94,843,"Tuhndraa","WordsAreVery",24,0," look  really feel like m middle warped converse ation  really sneaks sole","Cat screaming meme, My friend Lea, Watercolors on shoes, 2019","","https://i.redd.it/umoh5u7z7c241.jpg","i.redd.it","http://www.reddit.com/r/Art/comments/e5au1w/cat_screaming_meme_my_friend_lea_watercolors_on/?ref=search_posts"
"190",3,"2_1","03-12-19","03-12-19",17,"Art",0.94,843,"Tuhndraa","dada5714",1,0,"get man stage","Cat screaming meme, My friend Lea, Watercolors on shoes, 2019","","https://i.redd.it/umoh5u7z7c241.jpg","i.redd.it","http://www.reddit.com/r/Art/comments/e5au1w/cat_screaming_meme_my_friend_lea_watercolors_on/?ref=search_posts"
"191",4,"2_2","03-12-19","03-12-19",17,"Art",0.94,843,"Tuhndraa","JPierre90",1,0,"best comment ve read day","Cat screaming meme, My friend Lea, Watercolors on shoes, 2019","","https://i.redd.it/umoh5u7z7c241.jpg","i.redd.it","http://www.reddit.com/r/Art/comments/e5au1w/cat_screaming_meme_my_friend_lea_watercolors_on/?ref=search_posts"
"192",5,"3","03-12-19","03-12-19",17,"Art",0.94,843,"Tuhndraa","KriegersLeftNipple",6,0,"far favorite rendition meme","Cat screaming meme, My friend Lea, Watercolors on shoes, 2019","","https://i.redd.it/umoh5u7z7c241.jpg","i.redd.it","http://www.reddit.com/r/Art/comments/e5au1w/cat_screaming_meme_my_friend_lea_watercolors_on/?ref=search_posts"
"193",6,"4","03-12-19","03-12-19",17,"Art",0.94,843,"Tuhndraa","xUNIDx",4,0,"love way color flows great work","Cat screaming meme, My friend Lea, Watercolors on shoes, 2019","","https://i.redd.it/umoh5u7z7c241.jpg","i.redd.it","http://www.reddit.com/r/Art/comments/e5au1w/cat_screaming_meme_my_friend_lea_watercolors_on/?ref=search_posts"
"194",7,"5","03-12-19","03-12-19",17,"Art",0.94,843,"Tuhndraa","raebeetle",4,0,"hows keeping watercolour running","Cat screaming meme, My friend Lea, Watercolors on shoes, 2019","","https://i.redd.it/umoh5u7z7c241.jpg","i.redd.it","http://www.reddit.com/r/Art/comments/e5au1w/cat_screaming_meme_my_friend_lea_watercolors_on/?ref=search_posts"
"195",8,"6","03-12-19","03-12-19",17,"Art",0.94,843,"Tuhndraa","JPierre90",1,0,"fresh love","Cat screaming meme, My friend Lea, Watercolors on shoes, 2019","","https://i.redd.it/umoh5u7z7c241.jpg","i.redd.it","http://www.reddit.com/r/Art/comments/e5au1w/cat_screaming_meme_my_friend_lea_watercolors_on/?ref=search_posts"
"196",1,"1","06-12-19","06-12-19",28,"Art",0.98,1724,"natapio","Fakuri122",21,0,"ghilbi production art level great","No Title, me, watercolor, 2018","","https://i.redd.it/bzk42cetfy241.jpg","i.redd.it","http://www.reddit.com/r/Art/comments/e6uq46/no_title_me_watercolor_2018/?ref=search_posts"
"197",2,"1_1","06-12-19","06-12-19",28,"Art",0.98,1724,"natapio","natapio",4,0,"blushing thank","No Title, me, watercolor, 2018","","https://i.redd.it/bzk42cetfy241.jpg","i.redd.it","http://www.reddit.com/r/Art/comments/e6uq46/no_title_me_watercolor_2018/?ref=search_posts"
"198",3,"1_1_1","06-12-19","07-12-19",28,"Art",0.98,1724,"natapio","Baconcatboy",1,0,"great  reversed searched make sure didn steal came back good job","No Title, me, watercolor, 2018","","https://i.redd.it/bzk42cetfy241.jpg","i.redd.it","http://www.reddit.com/r/Art/comments/e6uq46/no_title_me_watercolor_2018/?ref=search_posts"
"199",4,"1_1_1_1","06-12-19","07-12-19",28,"Art",0.98,1724,"natapio","natapio",2,0,"uhm idea whole art  m confused  kinda make uncomfortable  can show unfinished work just case","No Title, me, watercolor, 2018","","https://i.redd.it/bzk42cetfy241.jpg","i.redd.it","http://www.reddit.com/r/Art/comments/e6uq46/no_title_me_watercolor_2018/?ref=search_posts"
"200",5,"2","06-12-19","06-12-19",28,"Art",0.98,1724,"natapio","SuddenCombustPorpois",6,0," like much nice work m knowledgable art watercolor  real charm","No Title, me, watercolor, 2018","","https://i.redd.it/bzk42cetfy241.jpg","i.redd.it","http://www.reddit.com/r/Art/comments/e6uq46/no_title_me_watercolor_2018/?ref=search_posts"
"201",6,"3","06-12-19","06-12-19",28,"Art",0.98,1724,"natapio","IrisMoroc",5,0,"m  sucker watercolors anime please  proper scan maybe make  sequence make  free little online artbook","No Title, me, watercolor, 2018","","https://i.redd.it/bzk42cetfy241.jpg","i.redd.it","http://www.reddit.com/r/Art/comments/e6uq46/no_title_me_watercolor_2018/?ref=search_posts"
"202",7,"3_1","06-12-19","06-12-19",28,"Art",0.98,1724,"natapio","natapio",3,0,"hmm actually  good idea   think ll online artbook  thank much ","No Title, me, watercolor, 2018","","https://i.redd.it/bzk42cetfy241.jpg","i.redd.it","http://www.reddit.com/r/Art/comments/e6uq46/no_title_me_watercolor_2018/?ref=search_posts"
"203",8,"4","06-12-19","06-12-19",28,"Art",0.98,1724,"natapio","JasperLazuli44",3,0,"reminds marnie stardew valley  little lt fantastic work lt","No Title, me, watercolor, 2018","","https://i.redd.it/bzk42cetfy241.jpg","i.redd.it","http://www.reddit.com/r/Art/comments/e6uq46/no_title_me_watercolor_2018/?ref=search_posts"
"204",9,"4_1","06-12-19","06-12-19",28,"Art",0.98,1724,"natapio","natapio",1,0,"thank lt","No Title, me, watercolor, 2018","","https://i.redd.it/bzk42cetfy241.jpg","i.redd.it","http://www.reddit.com/r/Art/comments/e6uq46/no_title_me_watercolor_2018/?ref=search_posts"
"205",10,"5","06-12-19","06-12-19",28,"Art",0.98,1724,"natapio","Ocean-gazer",6,0,"omg haha  love spend time shamrock garden","No Title, me, watercolor, 2018","","https://i.redd.it/bzk42cetfy241.jpg","i.redd.it","http://www.reddit.com/r/Art/comments/e6uq46/no_title_me_watercolor_2018/?ref=search_posts"
"206",11,"5_1","06-12-19","06-12-19",28,"Art",0.98,1724,"natapio","natapio",3,0,"lol ve never found  four  leaf clover quite sad   maybe m just unlucky","No Title, me, watercolor, 2018","","https://i.redd.it/bzk42cetfy241.jpg","i.redd.it","http://www.reddit.com/r/Art/comments/e6uq46/no_title_me_watercolor_2018/?ref=search_posts"
"207",12,"5_1_1","06-12-19","06-12-19",28,"Art",0.98,1724,"natapio","Ocean-gazer",3,0," haven either know others lol","No Title, me, watercolor, 2018","","https://i.redd.it/bzk42cetfy241.jpg","i.redd.it","http://www.reddit.com/r/Art/comments/e6uq46/no_title_me_watercolor_2018/?ref=search_posts"
"208",13,"5_1_2","06-12-19","06-12-19",28,"Art",0.98,1724,"natapio","HussyDude14",2,0," heard odds finding one like 10 000  seems unlikely possible freshman year high school class went 10 minutes  small clover patch behind school 20 people  us including found actual four leaf clovers time just actively look one maybe minutes maybe you ll find one hopefully","No Title, me, watercolor, 2018","","https://i.redd.it/bzk42cetfy241.jpg","i.redd.it","http://www.reddit.com/r/Art/comments/e6uq46/no_title_me_watercolor_2018/?ref=search_posts"
"209",14,"5_1_2_1","06-12-19","06-12-19",28,"Art",0.98,1724,"natapio","natapio",2,0,"wow amazing  hope  can find one soon  lucky ","No Title, me, watercolor, 2018","","https://i.redd.it/bzk42cetfy241.jpg","i.redd.it","http://www.reddit.com/r/Art/comments/e6uq46/no_title_me_watercolor_2018/?ref=search_posts"
"210",15,"6","06-12-19","06-12-19",28,"Art",0.98,1724,"natapio","tirrramisu",2,0," just went past posts hoping see work disappointed love art style pleasant thankyou sharing us","No Title, me, watercolor, 2018","","https://i.redd.it/bzk42cetfy241.jpg","i.redd.it","http://www.reddit.com/r/Art/comments/e6uq46/no_title_me_watercolor_2018/?ref=search_posts"
"211",16,"6_1","06-12-19","06-12-19",28,"Art",0.98,1724,"natapio","natapio",2,0,"thank much liking art","No Title, me, watercolor, 2018","","https://i.redd.it/bzk42cetfy241.jpg","i.redd.it","http://www.reddit.com/r/Art/comments/e6uq46/no_title_me_watercolor_2018/?ref=search_posts"
"212",17,"7","06-12-19","06-12-19",28,"Art",0.98,1724,"natapio","WockerOne",2,0,"feels like  new movie character","No Title, me, watercolor, 2018","","https://i.redd.it/bzk42cetfy241.jpg","i.redd.it","http://www.reddit.com/r/Art/comments/e6uq46/no_title_me_watercolor_2018/?ref=search_posts"
"213",18,"8","06-12-19","06-12-19",28,"Art",0.98,1724,"natapio","Sponska",2,0,"colour choices composition details  seriously love everything well done work looks incredible aswell serious talent got ","No Title, me, watercolor, 2018","","https://i.redd.it/bzk42cetfy241.jpg","i.redd.it","http://www.reddit.com/r/Art/comments/e6uq46/no_title_me_watercolor_2018/?ref=search_posts"
"214",19,"9","06-12-19","06-12-19",28,"Art",0.98,1724,"natapio","ArcticBlueCZ",2,0,"ivy carmen sandiego cool","No Title, me, watercolor, 2018","","https://i.redd.it/bzk42cetfy241.jpg","i.redd.it","http://www.reddit.com/r/Art/comments/e6uq46/no_title_me_watercolor_2018/?ref=search_posts"
"215",20,"10","06-12-19","06-12-19",28,"Art",0.98,1724,"natapio","SlayerOfHips",2,0," love reminds legend zelda minish cap   keep making art","No Title, me, watercolor, 2018","","https://i.redd.it/bzk42cetfy241.jpg","i.redd.it","http://www.reddit.com/r/Art/comments/e6uq46/no_title_me_watercolor_2018/?ref=search_posts"
"216",21,"11","06-12-19","06-12-19",28,"Art",0.98,1724,"natapio","Proglo02",3,0,"nice painting call lady luck","No Title, me, watercolor, 2018","","https://i.redd.it/bzk42cetfy241.jpg","i.redd.it","http://www.reddit.com/r/Art/comments/e6uq46/no_title_me_watercolor_2018/?ref=search_posts"
"217",22,"11_1","06-12-19","06-12-19",28,"Art",0.98,1724,"natapio","SteveV076",3,0,"gingerly luck","No Title, me, watercolor, 2018","","https://i.redd.it/bzk42cetfy241.jpg","i.redd.it","http://www.reddit.com/r/Art/comments/e6uq46/no_title_me_watercolor_2018/?ref=search_posts"
"218",23,"12","06-12-19","06-12-19",28,"Art",0.98,1724,"natapio","Haterbait_band",-3,0,"m seeing mascot fast food hamburger franchise us  racist caricature irish lass beer label model  dry irish stout","No Title, me, watercolor, 2018","","https://i.redd.it/bzk42cetfy241.jpg","i.redd.it","http://www.reddit.com/r/Art/comments/e6uq46/no_title_me_watercolor_2018/?ref=search_posts"
"219",24,"12_1","06-12-19","06-12-19",28,"Art",0.98,1724,"natapio","[deleted]",0,0,"deleted","No Title, me, watercolor, 2018","","https://i.redd.it/bzk42cetfy241.jpg","i.redd.it","http://www.reddit.com/r/Art/comments/e6uq46/no_title_me_watercolor_2018/?ref=search_posts"
"220",25,"12_1_1","06-12-19","06-12-19",28,"Art",0.98,1724,"natapio","kdtirado",3,0,"wendy","No Title, me, watercolor, 2018","","https://i.redd.it/bzk42cetfy241.jpg","i.redd.it","http://www.reddit.com/r/Art/comments/e6uq46/no_title_me_watercolor_2018/?ref=search_posts"
"221",1,"1","07-12-19","07-12-19",90,"Art",0.99,6442,"eradelphic","JudahRed",56,0,"lines painting just amazing look beautiful","Merchants Galley, me, watercolor, 2019","","https://i.redd.it/4slivmqgd7341.jpg","i.redd.it","http://www.reddit.com/r/Art/comments/e7dn1y/merchants_galley_me_watercolor_2019/?ref=search_posts"
"222",2,"1_1","07-12-19","08-12-19",90,"Art",0.99,6442,"eradelphic","YamesYamerson",2,0,"can confirm  zoomed around picture consistently pleased line work","Merchants Galley, me, watercolor, 2019","","https://i.redd.it/4slivmqgd7341.jpg","i.redd.it","http://www.reddit.com/r/Art/comments/e7dn1y/merchants_galley_me_watercolor_2019/?ref=search_posts"
"223",3,"2","07-12-19","07-12-19",90,"Art",0.99,6442,"eradelphic","InklanUtterfield",63,0,"genuinely one favourite watercolor painting ve ever seen stunning design technical ability everything right galley","Merchants Galley, me, watercolor, 2019","","https://i.redd.it/4slivmqgd7341.jpg","i.redd.it","http://www.reddit.com/r/Art/comments/e7dn1y/merchants_galley_me_watercolor_2019/?ref=search_posts"
"224",4,"2_1","07-12-19","07-12-19",90,"Art",0.99,6442,"eradelphic","ba3toven",9,0,"really bilges peehole","Merchants Galley, me, watercolor, 2019","","https://i.redd.it/4slivmqgd7341.jpg","i.redd.it","http://www.reddit.com/r/Art/comments/e7dn1y/merchants_galley_me_watercolor_2019/?ref=search_posts"
"225",5,"2_2","07-12-19","07-12-19",90,"Art",0.99,6442,"eradelphic","CommentContrarian",4,0,"watercolor","Merchants Galley, me, watercolor, 2019","","https://i.redd.it/4slivmqgd7341.jpg","i.redd.it","http://www.reddit.com/r/Art/comments/e7dn1y/merchants_galley_me_watercolor_2019/?ref=search_posts"
"226",6,"2_2_1","07-12-19","07-12-19",90,"Art",0.99,6442,"eradelphic","eradelphic",5,0," used  pen outline sure  lot watercolor artist  contrast effect  dont use pen shading though check  pen works","Merchants Galley, me, watercolor, 2019","","https://i.redd.it/4slivmqgd7341.jpg","i.redd.it","http://www.reddit.com/r/Art/comments/e7dn1y/merchants_galley_me_watercolor_2019/?ref=search_posts"
"227",7,"2_2_1_1","07-12-19","07-12-19",90,"Art",0.99,6442,"eradelphic","CommentContrarian",8,0,"love see sorry  came across disparaging just meant clarify","Merchants Galley, me, watercolor, 2019","","https://i.redd.it/4slivmqgd7341.jpg","i.redd.it","http://www.reddit.com/r/Art/comments/e7dn1y/merchants_galley_me_watercolor_2019/?ref=search_posts"
"228",8,"2_2_2","07-12-19","08-12-19",90,"Art",0.99,6442,"eradelphic","InklanUtterfield",1,0,"oh  know watercolor  ink one beautiful artistic combos extent  almost consider ink  natural part watercolor painting","Merchants Galley, me, watercolor, 2019","","https://i.redd.it/4slivmqgd7341.jpg","i.redd.it","http://www.reddit.com/r/Art/comments/e7dn1y/merchants_galley_me_watercolor_2019/?ref=search_posts"
