"","id","structure","post_date","comm_date","num_comments","subreddit","upvote_prop","post_score","author","user","comment_score","controversiality","comment","title","post_text","link","domain","URL"
"1",1,"1","09-12-19","09-12-19",2,"Art",1,4,"bogibag","TerrubLeRedditor",2,0,"work based pictures  mostly portraits moment  check owner original picture though  must admit majority stuff drawing people  know  use subreddit redditgetsdrawn references","Working with reference photos vs models? Opinions needed.","I am a young artist who doesnt have the opportunity to use models for her works. However I am planning to apply for a competition and I have found a nice photograph. Of course I am going to send an email to the artist and ask for his permission to use his work, but the thing bugs my mind is that is it unprofessional to use someones else photographs? I mean you dont put anything creative to it. What do you think about this? And any suggestions that i can do to add more of me to prove my artistic originality. I am also more into painting realistically (I mean i am not so good at it but thats my purpose) and I use watercolor as a medium. I live in states so, I am also curious if it is available to find models? How much does it cost to work with a model or how can I find a model?","https://www.reddit.com/r/Art/comments/e87duv/working_with_reference_photos_vs_models_opinions/","self.Art","http://www.reddit.com/r/Art/comments/e87duv/working_with_reference_photos_vs_models_opinions/?ref=search_posts"
"2",2,"1_1","09-12-19","09-12-19",2,"Art",1,4,"bogibag","bogibag",1,0,"thanks  check redditfetsdrawn","Working with reference photos vs models? Opinions needed.","I am a young artist who doesnt have the opportunity to use models for her works. However I am planning to apply for a competition and I have found a nice photograph. Of course I am going to send an email to the artist and ask for his permission to use his work, but the thing bugs my mind is that is it unprofessional to use someones else photographs? I mean you dont put anything creative to it. What do you think about this? And any suggestions that i can do to add more of me to prove my artistic originality. I am also more into painting realistically (I mean i am not so good at it but thats my purpose) and I use watercolor as a medium. I live in states so, I am also curious if it is available to find models? How much does it cost to work with a model or how can I find a model?","https://www.reddit.com/r/Art/comments/e87duv/working_with_reference_photos_vs_models_opinions/","self.Art","http://www.reddit.com/r/Art/comments/e87duv/working_with_reference_photos_vs_models_opinions/?ref=search_posts"
"3",1,"1","10-12-19","10-12-19",2,"Art",0.78,5,"SymmetryBoy","SymmetryBoy",1,0," work  made  friend  also wanted share community","Los Nacimientos, Me, Watercolor Pencils, 2019.","","https://i.redd.it/f7jf1rgoqp341.jpg","i.redd.it","http://www.reddit.com/r/Art/comments/e8jz8o/los_nacimientos_me_watercolor_pencils_2019/?ref=search_posts"
"4",1,"1","05-12-19","05-12-19",2,"Art",0.67,4,"sharklar","We_ebtrash",1,0,"picture quality kinda cloudy","Seeing things in clouds , me , ink and watercolor, 2019","","https://i.redd.it/5kh1s4yygp241.jpg","i.redd.it","http://www.reddit.com/r/Art/comments/e68h4r/seeing_things_in_clouds_me_ink_and_watercolor_2019/?ref=search_posts"
"5",1,"1","10-12-19","10-12-19",5,"Art",1,9,"DRPR","emailusernamepasswrd",2,0,"m always jealous people can master watercolor ink like every time  tried turned  big grey mess lol   beautiful job op","mar de vida, Me, Watercolor and Ink, 2019","","https://i.redd.it/fdkh8wz05t341.jpg","i.redd.it","http://www.reddit.com/r/Art/comments/e8qlrn/mar_de_vida_me_watercolor_and_ink_2019/?ref=search_posts"
"6",2,"1_1","10-12-19","10-12-19",5,"Art",1,9,"DRPR","DRPR",2,0,"thank may can start making small doodles also taking  good paper like arches good watercolors helps one took  month finish  just patient go litle litle","mar de vida, Me, Watercolor and Ink, 2019","","https://i.redd.it/fdkh8wz05t341.jpg","i.redd.it","http://www.reddit.com/r/Art/comments/e8qlrn/mar_de_vida_me_watercolor_and_ink_2019/?ref=search_posts"
"7",3,"1_2","10-12-19","10-12-19",5,"Art",1,9,"DRPR","LissaK",1,0," tricky medium sure great abstract details","mar de vida, Me, Watercolor and Ink, 2019","","https://i.redd.it/fdkh8wz05t341.jpg","i.redd.it","http://www.reddit.com/r/Art/comments/e8qlrn/mar_de_vida_me_watercolor_and_ink_2019/?ref=search_posts"
"8",1,"1","04-12-19","04-12-19",3,"Art",0.9,8,"sinkingspellart","ashinypennyforthough",2,0,"love reminds bojack horseman animation","Dapper Fellow, Me, Watercolor/Prismacolor Pencils, 2019","","https://i.redd.it/sna3bgrsdk241.jpg","i.redd.it","http://www.reddit.com/r/Art/comments/e5vdff/dapper_fellow_me_watercolorprismacolor_pencils/?ref=search_posts"
"9",2,"1_1","04-12-19","04-12-19",3,"Art",0.9,8,"sinkingspellart","sinkingspellart",1,0,"thank","Dapper Fellow, Me, Watercolor/Prismacolor Pencils, 2019","","https://i.redd.it/sna3bgrsdk241.jpg","i.redd.it","http://www.reddit.com/r/Art/comments/e5vdff/dapper_fellow_me_watercolorprismacolor_pencils/?ref=search_posts"
"10",1,"1","08-12-19","08-12-19",1,"Art",0.79,8,"Juash0","Funkington",1,0,"reminds breath wild","Unnamed Abstract Art Piece, Me, Watercolor and Paper Cutouts, 2019","","https://i.redd.it/x6j0mqluhc341.jpg","i.redd.it","http://www.reddit.com/r/Art/comments/e7pv62/unnamed_abstract_art_piece_me_watercolor_and/?ref=search_posts"
"11",1,"1","05-12-19","05-12-19",4,"Art",0.8,12,"bunkhitz","RedDevil1313",2,0,"omg amazing captured doggies personality great job","Untitled, Me, Watercolor, 2017","","https://i.redd.it/pj0sxfzxzv241.jpg","i.redd.it","http://www.reddit.com/r/Art/comments/e6oejc/untitled_me_watercolor_2017/?ref=search_posts"
"12",2,"1_1","05-12-19","06-12-19",4,"Art",0.8,12,"bunkhitz","bunkhitz",2,0,"thank","Untitled, Me, Watercolor, 2017","","https://i.redd.it/pj0sxfzxzv241.jpg","i.redd.it","http://www.reddit.com/r/Art/comments/e6oejc/untitled_me_watercolor_2017/?ref=search_posts"
"13",3,"1_1_1","05-12-19","06-12-19",4,"Art",0.8,12,"bunkhitz","RedDevil1313",2,0,"you re welcome","Untitled, Me, Watercolor, 2017","","https://i.redd.it/pj0sxfzxzv241.jpg","i.redd.it","http://www.reddit.com/r/Art/comments/e6oejc/untitled_me_watercolor_2017/?ref=search_posts"
"14",1,"1","09-12-19","09-12-19",1,"Art",0.75,13,"ravioliss","artcatss",1,0,"woahhhh  really like","untitled, me, colored pencil on watercolor paper, 2019","","https://i.redd.it/17pn2eskei341.jpg","i.redd.it","http://www.reddit.com/r/Art/comments/e82qkp/untitled_me_colored_pencil_on_watercolor_paper/?ref=search_posts"
"15",1,"1","04-12-19","04-12-19",2,"Art",0.94,14,"Autumnpoe","W-styd",0,0,"watercolor go darkest colors first lighter lighter","Mountain beauty, artist/me, watercolor on paper, 2019","","https://i.redd.it/a3131ppf5k241.jpg","i.redd.it","http://www.reddit.com/r/Art/comments/e5uwas/mountain_beauty_artistme_watercolor_on_paper_2019/?ref=search_posts"
"16",1,"1","09-12-19","09-12-19",2,"Art",0.87,17,"dthieu","gruntvald",1,0,"watercolor just extraordinary  resounding talent medium","Resounding times, Phong Hoang, watercolor, 2019","","https://i.imgur.com/66SnSe7.jpg","i.imgur.com","http://www.reddit.com/r/Art/comments/e8b7rh/resounding_times_phong_hoang_watercolor_2019/?ref=search_posts"
"17",2,"2","09-12-19","09-12-19",2,"Art",0.87,17,"dthieu","lacunagoon",1,0," didn see title scrolling  thought photography amazing job","Resounding times, Phong Hoang, watercolor, 2019","","https://i.imgur.com/66SnSe7.jpg","i.imgur.com","http://www.reddit.com/r/Art/comments/e8b7rh/resounding_times_phong_hoang_watercolor_2019/?ref=search_posts"
"18",1,"1","08-12-19","08-12-19",1,"Art",0.88,22,"paintingforbeginners","humdrum_humphrey",1,0,"serene d love live across admire everytime  look window","Winter Landscape - Chalet with Pine Trees and Silver Birch Trees, me, watercolor, 2019","","https://i.redd.it/gtu70u33rc341.jpg","i.redd.it","http://www.reddit.com/r/Art/comments/e7qd6t/winter_landscape_chalet_with_pine_trees_and/?ref=search_posts"
"19",1,"1","10-12-19","10-12-19",3,"Art",0.89,27,"funartwork","longfingerstank",3,0,"bruh  movie kinda fucked  btw lovely art","Silent voice, me, watercolor pencils, 2019","","https://i.redd.it/44r4gbeq2t341.jpg","i.redd.it","http://www.reddit.com/r/Art/comments/e8qfu7/silent_voice_me_watercolor_pencils_2019/?ref=search_posts"
"20",2,"2","10-12-19","10-12-19",3,"Art",0.89,27,"funartwork","IceyCats",2,0,"lovely art  lovely movie  wierd beginning","Silent voice, me, watercolor pencils, 2019","","https://i.redd.it/44r4gbeq2t341.jpg","i.redd.it","http://www.reddit.com/r/Art/comments/e8qfu7/silent_voice_me_watercolor_pencils_2019/?ref=search_posts"
"21",1,"1","05-12-19","05-12-19",1,"Art",0.87,27,"kitkatkatibaby","burlybuhda",1,0,"nicely done   now tweet repdevinnunes  hear likes cows","Calf, Me, Watercolors, 2019","","https://i.redd.it/n1wrraw0xu241.jpg","i.redd.it","http://www.reddit.com/r/Art/comments/e6l66z/calf_me_watercolors_2019/?ref=search_posts"
"22",1,"1","10-12-19","10-12-19",6,"Art",0.95,20,"Emmawrote","BaconRoad",2,0,"first  like","Self portrait, me, watercolor markers, 2019","","https://i.redd.it/xlrsb9qysp341.jpg","i.redd.it","http://www.reddit.com/r/Art/comments/e8k2ku/self_portrait_me_watercolor_markers_2019/?ref=search_posts"
"23",2,"1_1","10-12-19","10-12-19",6,"Art",0.95,20,"Emmawrote","Emmawrote",2,0," just put   outline almost highlighter colored orange water color marker also   mirror","Self portrait, me, watercolor markers, 2019","","https://i.redd.it/xlrsb9qysp341.jpg","i.redd.it","http://www.reddit.com/r/Art/comments/e8k2ku/self_portrait_me_watercolor_markers_2019/?ref=search_posts"
"24",3,"1_1_1","10-12-19","10-12-19",6,"Art",0.95,20,"Emmawrote","BaconRoad",2,0,"marker first watercolor","Self portrait, me, watercolor markers, 2019","","https://i.redd.it/xlrsb9qysp341.jpg","i.redd.it","http://www.reddit.com/r/Art/comments/e8k2ku/self_portrait_me_watercolor_markers_2019/?ref=search_posts"
"25",4,"1_1_1_1","10-12-19","10-12-19",6,"Art",0.95,20,"Emmawrote","Emmawrote",2,0,"literally markers work kinda like water color brushes ink","Self portrait, me, watercolor markers, 2019","","https://i.redd.it/xlrsb9qysp341.jpg","i.redd.it","http://www.reddit.com/r/Art/comments/e8k2ku/self_portrait_me_watercolor_markers_2019/?ref=search_posts"
"26",5,"1_1_1_1_1","10-12-19","10-12-19",6,"Art",0.95,20,"Emmawrote","BaconRoad",2,0,"oh cool mom  water colorist  get christmas   envy artists can watercolor   think one difficult mediums work","Self portrait, me, watercolor markers, 2019","","https://i.redd.it/xlrsb9qysp341.jpg","i.redd.it","http://www.reddit.com/r/Art/comments/e8k2ku/self_portrait_me_watercolor_markers_2019/?ref=search_posts"
"27",1,"1","04-12-19","04-12-19",2,"Art",0.96,19,"Franco_R","scarlit",2,0," like  lot bull  think    and maybe  tough day","Olkhon Bull, me, watercolor and ink, 2017","","https://i.redd.it/6lt6qj00pm241.jpg","i.redd.it","http://www.reddit.com/r/Art/comments/e60804/olkhon_bull_me_watercolor_and_ink_2017/?ref=search_posts"
"28",2,"1_1","04-12-19","05-12-19",2,"Art",0.96,19,"Franco_R","Franco_R",1,0,"thank  heh maybe","Olkhon Bull, me, watercolor and ink, 2017","","https://i.redd.it/6lt6qj00pm241.jpg","i.redd.it","http://www.reddit.com/r/Art/comments/e60804/olkhon_bull_me_watercolor_and_ink_2017/?ref=search_posts"
"29",1,"1","08-12-19","08-12-19",2,"Art",0.94,21,"Shumbee","Shumbee",1,0,"beautiful polly ellens","Freckles, Dina Krikova, Watercolor, 2017","","https://i.redd.it/qd27elk1rf341.png","i.redd.it","http://www.reddit.com/r/Art/comments/e7vnqf/freckles_dina_krikova_watercolor_2017/?ref=search_posts"
"30",1,"1","08-12-19","08-12-19",3,"Art",0.91,24,"coraIreefer","AlmightyOne23",2,0," beautiful piece nice","Chief, Me, Watercolor+Gouache, 2019.","","https://i.redd.it/qsbkxsdjdc341.jpg","i.redd.it","http://www.reddit.com/r/Art/comments/e7plr7/chief_me_watercolorgouache_2019/?ref=search_posts"
"31",2,"1_1","08-12-19","08-12-19",3,"Art",0.91,24,"coraIreefer","coraIreefer",2,0,"thank kind words","Chief, Me, Watercolor+Gouache, 2019.","","https://i.redd.it/qsbkxsdjdc341.jpg","i.redd.it","http://www.reddit.com/r/Art/comments/e7plr7/chief_me_watercolorgouache_2019/?ref=search_posts"
"32",3,"1_1_1","08-12-19","08-12-19",3,"Art",0.91,24,"coraIreefer","AlmightyOne23",1,0,"thank painting  beautiful woofer","Chief, Me, Watercolor+Gouache, 2019.","","https://i.redd.it/qsbkxsdjdc341.jpg","i.redd.it","http://www.reddit.com/r/Art/comments/e7plr7/chief_me_watercolorgouache_2019/?ref=search_posts"
"33",1,"1","04-12-19","04-12-19",2,"Art",0.94,24,"paige-by-paige","I_AM_A_CHAD_",1,0,"photo taken","Evening Clouds, me, watercolor, 2019","","https://i.redd.it/uqomknabqn241.jpg","i.redd.it","http://www.reddit.com/r/Art/comments/e636lb/evening_clouds_me_watercolor_2019/?ref=search_posts"
"34",1,"1","10-12-19","10-12-19",2,"Art",0.9,21,"Franco_R","Astro1194",2,0,"super cool love subtle differences colour","Devil, me, watercolor and ink, 2018","","https://i.redd.it/obbv5xzgxr341.jpg","i.redd.it","http://www.reddit.com/r/Art/comments/e8ogbq/devil_me_watercolor_and_ink_2018/?ref=search_posts"
"35",2,"1_1","10-12-19","10-12-19",2,"Art",0.9,21,"Franco_R","Franco_R",1,0,"thank","Devil, me, watercolor and ink, 2018","","https://i.redd.it/obbv5xzgxr341.jpg","i.redd.it","http://www.reddit.com/r/Art/comments/e8ogbq/devil_me_watercolor_and_ink_2018/?ref=search_posts"
"36",1,"1","07-12-19","07-12-19",5,"Art",0.9,21,"slowburnstudio","art_is_science",2,0,"go starbucks thanksgiving","Thanksgiving at Starbucks, Me, watercolor N gouache, 2019","","https://i.redd.it/3ejc29s9a6341.jpg","i.redd.it","http://www.reddit.com/r/Art/comments/e7byhk/thanksgiving_at_starbucks_me_watercolor_n_gouache/?ref=search_posts"
"37",2,"1_1","07-12-19","07-12-19",5,"Art",0.9,21,"slowburnstudio","slowburnstudio",1,0,"yes  dinner  went grabbed coffee boyfriend hung  bit paint","Thanksgiving at Starbucks, Me, watercolor N gouache, 2019","","https://i.redd.it/3ejc29s9a6341.jpg","i.redd.it","http://www.reddit.com/r/Art/comments/e7byhk/thanksgiving_at_starbucks_me_watercolor_n_gouache/?ref=search_posts"
"38",3,"2","07-12-19","07-12-19",5,"Art",0.9,21,"slowburnstudio","shooji",2,0,"gives  warm cozy vibe love everything","Thanksgiving at Starbucks, Me, watercolor N gouache, 2019","","https://i.redd.it/3ejc29s9a6341.jpg","i.redd.it","http://www.reddit.com/r/Art/comments/e7byhk/thanksgiving_at_starbucks_me_watercolor_n_gouache/?ref=search_posts"
"39",4,"2_1","07-12-19","07-12-19",5,"Art",0.9,21,"slowburnstudio","slowburnstudio",2,0,"thank","Thanksgiving at Starbucks, Me, watercolor N gouache, 2019","","https://i.redd.it/3ejc29s9a6341.jpg","i.redd.it","http://www.reddit.com/r/Art/comments/e7byhk/thanksgiving_at_starbucks_me_watercolor_n_gouache/?ref=search_posts"
"40",1,"1","03-12-19","03-12-19",4,"Art",0.91,26,"marlaburse","sgf_reddit",2,0," never understand art","No. 184, Me, Watercolor and ink on paper, 2019","","https://i.redd.it/qg7q774fqc241.jpg","i.redd.it","http://www.reddit.com/r/Art/comments/e5c3of/no_184_me_watercolor_and_ink_on_paper_2019/?ref=search_posts"
"41",2,"1_1","03-12-19","03-12-19",4,"Art",0.91,26,"marlaburse","JDampier",2,0," pirate ship dog like seeing stuff clouds","No. 184, Me, Watercolor and ink on paper, 2019","","https://i.redd.it/qg7q774fqc241.jpg","i.redd.it","http://www.reddit.com/r/Art/comments/e5c3of/no_184_me_watercolor_and_ink_on_paper_2019/?ref=search_posts"
"42",3,"1_1_1","03-12-19","03-12-19",4,"Art",0.91,26,"marlaburse","sgf_reddit",2,0,"lay weed bro","No. 184, Me, Watercolor and ink on paper, 2019","","https://i.redd.it/qg7q774fqc241.jpg","i.redd.it","http://www.reddit.com/r/Art/comments/e5c3of/no_184_me_watercolor_and_ink_on_paper_2019/?ref=search_posts"
"43",4,"1_1_2","03-12-19","03-12-19",4,"Art",0.91,26,"marlaburse","marlaburse",2,0,"never lay weed else get nonsense art    ","No. 184, Me, Watercolor and ink on paper, 2019","","https://i.redd.it/qg7q774fqc241.jpg","i.redd.it","http://www.reddit.com/r/Art/comments/e5c3of/no_184_me_watercolor_and_ink_on_paper_2019/?ref=search_posts"
"44",1,"1","05-12-19","06-12-19",3,"Art",0.91,28,"lizaffect","Echonix9",3,0,"nice makes want get back watercolours","Winter Walk, Me, Watercolor, 2019","","https://i.redd.it/c6vqao5xhw241.jpg","i.redd.it","http://www.reddit.com/r/Art/comments/e6publ/winter_walk_me_watercolor_2019/?ref=search_posts"
"45",2,"1_1","05-12-19","06-12-19",3,"Art",0.91,28,"lizaffect","lizaffect",2,0,"thank m new far ve  lot fun","Winter Walk, Me, Watercolor, 2019","","https://i.redd.it/c6vqao5xhw241.jpg","i.redd.it","http://www.reddit.com/r/Art/comments/e6publ/winter_walk_me_watercolor_2019/?ref=search_posts"
"46",1,"1","04-12-19","04-12-19",5,"Art",0.87,30,"cerealbowling","cerealbowling",1,0,"done  birthday card grandfather behind meaning","This way, Me, Ink and watercolor, 2019","","https://i.redd.it/34e4kekopk241.jpg","i.redd.it","http://www.reddit.com/r/Art/comments/e5w0c0/this_way_me_ink_and_watercolor_2019/?ref=search_posts"
"47",2,"1_1","04-12-19","04-12-19",5,"Art",0.87,30,"cerealbowling","Ashtarr",1,0,"react","This way, Me, Ink and watercolor, 2019","","https://i.redd.it/34e4kekopk241.jpg","i.redd.it","http://www.reddit.com/r/Art/comments/e5w0c0/this_way_me_ink_and_watercolor_2019/?ref=search_posts"
"48",3,"1_1_1","04-12-19","05-12-19",5,"Art",0.87,30,"cerealbowling","cerealbowling",1,0,"guess liked  lot  quiet finnish man sometimes hard tell haha","This way, Me, Ink and watercolor, 2019","","https://i.redd.it/34e4kekopk241.jpg","i.redd.it","http://www.reddit.com/r/Art/comments/e5w0c0/this_way_me_ink_and_watercolor_2019/?ref=search_posts"
"49",4,"2","04-12-19","04-12-19",5,"Art",0.87,30,"cerealbowling","Velger-the-Fox",1,0,"beautiful piece m seeing  lot heikala vibe lt","This way, Me, Ink and watercolor, 2019","","https://i.redd.it/34e4kekopk241.jpg","i.redd.it","http://www.reddit.com/r/Art/comments/e5w0c0/this_way_me_ink_and_watercolor_2019/?ref=search_posts"
"50",5,"2_1","04-12-19","05-12-19",5,"Art",0.87,30,"cerealbowling","cerealbowling",1,0,"thank m sure whether vibe intentional m  big fan heikala amazing work","This way, Me, Ink and watercolor, 2019","","https://i.redd.it/34e4kekopk241.jpg","i.redd.it","http://www.reddit.com/r/Art/comments/e5w0c0/this_way_me_ink_and_watercolor_2019/?ref=search_posts"
"51",1,"1","03-12-19","03-12-19",2,"Art",1,38,"AshtonPatterson","AshtonPatterson",1,0," also used marker sorry glare glossy surface parts","The Weather Trio, Watercolor/Colored Pencil, Me, 2019","","https://i.redd.it/zlgl3t2kng241.jpg","i.redd.it","http://www.reddit.com/r/Art/comments/e5l81v/the_weather_trio_watercolorcolored_pencil_me_2019/?ref=search_posts"
"52",1,"1","04-12-19","04-12-19",2,"Art",0.9,41,"janicegoldy","ehtechnically",1,0," really lovely painting  appreciate detail color style  ton   thank sharing","Self portrait, me, watercolor, 2019","","https://i.redd.it/h72jvs597k241.jpg","i.redd.it","http://www.reddit.com/r/Art/comments/e5v06d/self_portrait_me_watercolor_2019/?ref=search_posts"
"53",1,"1","10-12-19","10-12-19",2,"Art",0.97,59,"salt_watercolors","isselfhatredeffay",1,0,"many shrimps eat","Pink, Me, Watercolor, 2019","","https://i.redd.it/8oru20hdzs341.jpg","i.redd.it","http://www.reddit.com/r/Art/comments/e8q8xq/pink_me_watercolor_2019/?ref=search_posts"
"54",1,"1","05-12-19","05-12-19",2,"Art",0.93,43,"aquabunart","beachiestsnob",3,0,"cute rad fuk  like  offer one suggestion put  padded envelope mail ","Dragon Bunny, me, watercolor, 2019","","https://i.redd.it/ddsfeje8nv241.jpg","i.redd.it","http://www.reddit.com/r/Art/comments/e6nc15/dragon_bunny_me_watercolor_2019/?ref=search_posts"
"55",1,"1","09-12-19","09-12-19",3,"Art",0.93,43,"Opuhlos","sidneyprice123",1,0,"something eddie paint","Shady Street, Me, Watercolors, 2019","","https://i.redd.it/o61e8t4udo341.jpg","i.redd.it","http://www.reddit.com/r/Art/comments/e8gboj/shady_street_me_watercolors_2019/?ref=search_posts"
"56",2,"1_1","09-12-19","09-12-19",3,"Art",0.93,43,"Opuhlos","Opuhlos",2,0,"eddie","Shady Street, Me, Watercolors, 2019","","https://i.redd.it/o61e8t4udo341.jpg","i.redd.it","http://www.reddit.com/r/Art/comments/e8gboj/shady_street_me_watercolors_2019/?ref=search_posts"
"57",1,"1","03-12-19","04-12-19",2,"Art",1,49,"Litswd","werlior",1,0,"oooh  like wonderful texture","""Calcite"", Leah L (me), Watercolor, 2019","","https://i.imgur.com/k3itO0l.jpg","i.imgur.com","http://www.reddit.com/r/Art/comments/e5jyvg/calcite_leah_l_me_watercolor_2019/?ref=search_posts"
"58",1,"1","07-12-19","07-12-19",4,"Art",0.9,42,"sinkingspellart","Dram1us",2,0," can see  fire dark pokemon     edit excellent work","FlamingNO, Me, Watercolor, 2019","","https://i.redd.it/77y33971p5341.jpg","i.redd.it","http://www.reddit.com/r/Art/comments/e7b03o/flamingno_me_watercolor_2019/?ref=search_posts"
"59",2,"1_1","07-12-19","07-12-19",4,"Art",0.9,42,"sinkingspellart","moremuch",3,0," gonna say doduo evil twin","FlamingNO, Me, Watercolor, 2019","","https://i.redd.it/77y33971p5341.jpg","i.redd.it","http://www.reddit.com/r/Art/comments/e7b03o/flamingno_me_watercolor_2019/?ref=search_posts"
"60",3,"1_1_1","07-12-19","08-12-19",4,"Art",0.9,42,"sinkingspellart","sinkingspellart",1,0,"perfect","FlamingNO, Me, Watercolor, 2019","","https://i.redd.it/77y33971p5341.jpg","i.redd.it","http://www.reddit.com/r/Art/comments/e7b03o/flamingno_me_watercolor_2019/?ref=search_posts"
"61",4,"1_2","07-12-19","07-12-19",4,"Art",0.9,42,"sinkingspellart","sinkingspellart",2,0," that   edit thank much","FlamingNO, Me, Watercolor, 2019","","https://i.redd.it/77y33971p5341.jpg","i.redd.it","http://www.reddit.com/r/Art/comments/e7b03o/flamingno_me_watercolor_2019/?ref=search_posts"
"62",1,"1","06-12-19","06-12-19",9,"Art",0.93,44,"NatalliaValiukevich","RedDevil1313",3,0,"extremely realistic great job u","Two sisters Second version, Me, Watercolor, 2019","","https://i.redd.it/vc1v5s7dr2341.jpg","i.redd.it","http://www.reddit.com/r/Art/comments/e748tx/two_sisters_second_version_me_watercolor_2019/?ref=search_posts"
"63",2,"1_1","06-12-19","06-12-19",9,"Art",0.93,44,"NatalliaValiukevich","NatalliaValiukevich",2,0," thank","Two sisters Second version, Me, Watercolor, 2019","","https://i.redd.it/vc1v5s7dr2341.jpg","i.redd.it","http://www.reddit.com/r/Art/comments/e748tx/two_sisters_second_version_me_watercolor_2019/?ref=search_posts"
"64",3,"1_1_1","06-12-19","06-12-19",9,"Art",0.93,44,"NatalliaValiukevich","RedDevil1313",2,0,"you re welcome","Two sisters Second version, Me, Watercolor, 2019","","https://i.redd.it/vc1v5s7dr2341.jpg","i.redd.it","http://www.reddit.com/r/Art/comments/e748tx/two_sisters_second_version_me_watercolor_2019/?ref=search_posts"
"65",4,"2","06-12-19","06-12-19",9,"Art",0.93,44,"NatalliaValiukevich","FerisProbitatis",2,0," knew slavic even  saw username just looking girls faces amazing talent looks amazing really captures whimsical atmosphere","Two sisters Second version, Me, Watercolor, 2019","","https://i.redd.it/vc1v5s7dr2341.jpg","i.redd.it","http://www.reddit.com/r/Art/comments/e748tx/two_sisters_second_version_me_watercolor_2019/?ref=search_posts"
"66",5,"2_1","06-12-19","06-12-19",9,"Art",0.93,44,"NatalliaValiukevich","NatalliaValiukevich",2,0,"thanks yes  also plan paint one slav  national costume near future","Two sisters Second version, Me, Watercolor, 2019","","https://i.redd.it/vc1v5s7dr2341.jpg","i.redd.it","http://www.reddit.com/r/Art/comments/e748tx/two_sisters_second_version_me_watercolor_2019/?ref=search_posts"
"67",6,"3","06-12-19","06-12-19",9,"Art",0.93,44,"NatalliaValiukevich","eyesonthepie",2,0,"oh wow  wonderful way using watercolors  almost couldn tell watercolor  saw light drops right well done   although make ratio image paper  bit different m used  reason like  distant memory","Two sisters Second version, Me, Watercolor, 2019","","https://i.redd.it/vc1v5s7dr2341.jpg","i.redd.it","http://www.reddit.com/r/Art/comments/e748tx/two_sisters_second_version_me_watercolor_2019/?ref=search_posts"
"68",7,"3_1","06-12-19","06-12-19",9,"Art",0.93,44,"NatalliaValiukevich","NatalliaValiukevich",2,0,"thanks old watercolor postcards inspiration","Two sisters Second version, Me, Watercolor, 2019","","https://i.redd.it/vc1v5s7dr2341.jpg","i.redd.it","http://www.reddit.com/r/Art/comments/e748tx/two_sisters_second_version_me_watercolor_2019/?ref=search_posts"
"69",8,"3_1_1","06-12-19","06-12-19",9,"Art",0.93,44,"NatalliaValiukevich","eyesonthepie",1,0,"ah makese sense chance paint  blank postcard ideal","Two sisters Second version, Me, Watercolor, 2019","","https://i.redd.it/vc1v5s7dr2341.jpg","i.redd.it","http://www.reddit.com/r/Art/comments/e748tx/two_sisters_second_version_me_watercolor_2019/?ref=search_posts"
"70",9,"3_1_1_1","06-12-19","06-12-19",9,"Art",0.93,44,"NatalliaValiukevich","NatalliaValiukevich",2,0," paint expensive cotton watercolor paper  can print postcards  can paint postcard paper","Two sisters Second version, Me, Watercolor, 2019","","https://i.redd.it/vc1v5s7dr2341.jpg","i.redd.it","http://www.reddit.com/r/Art/comments/e748tx/two_sisters_second_version_me_watercolor_2019/?ref=search_posts"
"71",1,"1","05-12-19","05-12-19",8,"Art",0.95,46,"LissaK","Onlyhere_4dogs",3,0,"well done difficult see  dance  tangling looking reminds fishing wire waterways ","Untitled, Me, Ink and Watercolor, 2019","","https://i.redd.it/paz47kt2kt241.jpg","i.redd.it","http://www.reddit.com/r/Art/comments/e6hedg/untitled_me_ink_and_watercolor_2019/?ref=search_posts"
"72",2,"2","05-12-19","08-12-19",8,"Art",0.95,46,"LissaK","miab0616",2,0,"ive never seen art like satisfying","Untitled, Me, Ink and Watercolor, 2019","","https://i.redd.it/paz47kt2kt241.jpg","i.redd.it","http://www.reddit.com/r/Art/comments/e6hedg/untitled_me_ink_and_watercolor_2019/?ref=search_posts"
